{
  "schema": "aalie.content.space",
  "schemaVersion": "1.0.0",
  "spaceId": "user-guide",
  "slug": "user-guide",
  "kind": "guide",
  "title": "User Guide",
  "description": "Pedagogical guide to algorithm design and analysis using AALIE as evidence: measurement, cost, iteration, recursion, interpretation, invariants, and analysis limits.",
  "locale": "en",
  "version": "1.0.0",
  "status": "published",
  "search": {
    "enabled": true,
    "indexText": true,
    "indexStructure": true,
    "indexTerms": true,
    "indexReferences": true,
    "indexCaptions": true
  },
  "progress": {
    "unit": "section",
    "paginationUnit": "section"
  },
  "theme": {
    "icon": "menu_book",
    "accentColor": "#0EA5E9"
  }
}
